system,k,question,expected,answer,retrieved,precision,recall,f1,hit_at_1,retrieval_recall_at_1,retrieval_precision_at_1,hit_at_3,retrieval_recall_at_3,retrieval_precision_at_3,hit_at_5,retrieval_recall_at_5,retrieval_precision_at_5,hit_at_10,retrieval_recall_at_10,retrieval_precision_at_10,hit_at_15,retrieval_recall_at_15,retrieval_precision_at_15
metadata_aware_hybrid_rag_k5,5,Which scholarships are available to Mongolian students?,Australia Awards; Chevening Scholarship; Chinese Government Scholarship; Erasmus Mundus Joint Master Degrees; Fulbright U.S. Student Program; Global Korea Scholarship; MEXT Scholarship; Stipendium Hungaricum; Swiss Government Excellence Scholarships; Türkiye Scholarships,AAUW International Fellowships; Australia Awards; DAAD Scholarships; Erasmus Mundus Joint Master Degrees; Government of Ireland International Education Scholarship; Swiss Government Excellence Scholarships; Türkiye Scholarships,Erasmus Mundus Joint Master Degrees; Swiss Government Excellence Scholarships; Boren Awards; Swedish Institute Scholarships; Vanier Canada Graduate Scholarships; United Nations Fellowships; Benjamin A. Gilman International Scholarship; Australia Awards; Commonwealth Scholarship and Fellowship Plan; Fulbright U.S. Student Program; Marshall Scholarship; DAAD Scholarships; Government of Ireland International Education Scholarship; Türkiye Scholarships; AAUW International Fellowships,0.5714285714285714,0.4,0.47058823529411764,1,0.1,1.0,1,0.2,0.6666666666666666,1,0.2,0.4,1,0.4,0.4,1,0.5,0.3333333333333333
metadata_aware_hybrid_rag_k5,5,Which scholarships can Mongolian students apply to in Japan?,Asian Development Bank–Japan Scholarship Program; JICA Scholarships; MEXT Scholarship,JICA Scholarships; Japan-IMF Scholarship Program for Asia; MEXT Scholarship,MEXT Scholarship; Japan-IMF Scholarship Program for Asia; Asian Development Bank–Japan Scholarship Program; JICA Scholarships; Joint Japan/World Bank Graduate Scholarship Program,0.6666666666666666,0.6666666666666666,0.6666666666666666,1,0.3333333333333333,1.0,1,0.6666666666666666,0.6666666666666666,1,1.0,0.6,1,1.0,0.3,1,1.0,0.2
metadata_aware_hybrid_rag_k5,5,Which scholarships can Mongolian students apply to in the UK?,Chevening Scholarship; Gates Cambridge Scholarship; Rhodes Scholarship,Chevening Scholarship; Gates Cambridge Scholarship,Chevening Scholarship; Commonwealth Scholarship and Fellowship Plan; Marshall Scholarship; Churchill Scholarship; Gates Cambridge Scholarship,1.0,0.6666666666666666,0.8,1,0.3333333333333333,1.0,1,0.3333333333333333,0.3333333333333333,1,0.6666666666666666,0.4,1,0.6666666666666666,0.2,1,0.6666666666666666,0.13333333333333333
metadata_aware_hybrid_rag_k5,5,Which scholarships can Mongolian students apply to in Australia?,Australia Awards,Australia Awards,Australia Awards; MEXT Scholarship; Global Korea Scholarship; Swedish Institute Scholarships; Erasmus Mundus Joint Master Degrees,1.0,1.0,1.0,1,1.0,1.0,1,1.0,0.3333333333333333,1,1.0,0.2,1,1.0,0.1,1,1.0,0.06666666666666667
metadata_aware_hybrid_rag_k5,5,Which scholarships can Mongolian students apply to in South Korea?,Global Korea Scholarship,Global Korea Scholarship,Global Korea Scholarship; MEXT Scholarship; Chinese Government Scholarship; Schwarzman Scholars; Türkiye Scholarships,1.0,1.0,1.0,1,1.0,1.0,1,1.0,0.3333333333333333,1,1.0,0.2,1,1.0,0.1,1,1.0,0.06666666666666667
metadata_aware_hybrid_rag_k5,5,Which scholarships are available in Germany for Mongolian students?,DAAD Scholarships,DAAD Scholarships,DAAD Scholarships; Swiss Government Excellence Scholarships; Erasmus Mundus Joint Master Degrees; Eiffel Excellence Scholarship Program; Stipendium Hungaricum; Swedish Institute Scholarships; United Nations Fellowships; Government of Ireland International Education Scholarship; Churchill Scholarship; George J. Mitchell Scholarship; The Gates Scholarship; Vanier Canada Graduate Scholarships; Marshall Scholarship; Australia Awards; Boren Awards,1.0,1.0,1.0,1,1.0,1.0,1,1.0,0.3333333333333333,1,1.0,0.2,1,1.0,0.1,1,1.0,0.06666666666666667
metadata_aware_hybrid_rag_k5,5,Which scholarships are available in Hungary for Mongolian students?,Stipendium Hungaricum,Stipendium Hungaricum,Stipendium Hungaricum; Swiss Government Excellence Scholarships; Erasmus Mundus Joint Master Degrees; Eiffel Excellence Scholarship Program; DAAD Scholarships; Swedish Institute Scholarships; United Nations Fellowships; Government of Ireland International Education Scholarship; George J. Mitchell Scholarship; The Gates Scholarship; Australia Awards; Vanier Canada Graduate Scholarships; Marshall Scholarship; AAUW International Fellowships; Boren Awards,1.0,1.0,1.0,1,1.0,1.0,1,1.0,0.3333333333333333,1,1.0,0.2,1,1.0,0.1,1,1.0,0.06666666666666667
metadata_aware_hybrid_rag_k5,5,Which scholarships are available in France for Mongolian students?,Eiffel Excellence Scholarship Program,Eiffel Excellence Scholarship Program,Eiffel Excellence Scholarship Program; Erasmus Mundus Joint Master Degrees; Swiss Government Excellence Scholarships; Vanier Canada Graduate Scholarships; DAAD Scholarships; Stipendium Hungaricum; Swedish Institute Scholarships; United Nations Fellowships; Government of Ireland International Education Scholarship; George J. Mitchell Scholarship; The Gates Scholarship; Churchill Scholarship; Marshall Scholarship; Australia Awards; AAUW International Fellowships,1.0,1.0,1.0,1,1.0,1.0,1,1.0,0.3333333333333333,1,1.0,0.2,1,1.0,0.1,1,1.0,0.06666666666666667
metadata_aware_hybrid_rag_k5,5,Which scholarships are available in Switzerland for Mongolian students?,Swiss Government Excellence Scholarships,Swiss Government Excellence Scholarships,Swiss Government Excellence Scholarships; Erasmus Mundus Joint Master Degrees; Eiffel Excellence Scholarship Program; DAAD Scholarships; Stipendium Hungaricum; Swedish Institute Scholarships; United Nations Fellowships; Government of Ireland International Education Scholarship; The Gates Scholarship; George J. Mitchell Scholarship; Vanier Canada Graduate Scholarships; Boren Awards; Australia Awards; Marshall Scholarship; Churchill Scholarship,1.0,1.0,1.0,1,1.0,1.0,1,1.0,0.3333333333333333,1,1.0,0.2,1,1.0,0.1,1,1.0,0.06666666666666667
metadata_aware_hybrid_rag_k5,5,Which scholarships are available in Turkey for Mongolian students?,Türkiye Scholarships,Türkiye Scholarships,Türkiye Scholarships; Joint Japan/World Bank Graduate Scholarship Program; JICA Scholarships; Japan-IMF Scholarship Program for Asia; Chinese Government Scholarship; Schwarzman Scholars; MEXT Scholarship; Global Korea Scholarship; Asian Development Bank–Japan Scholarship Program; ADB Internship Program; Swiss Government Excellence Scholarships; Erasmus Mundus Joint Master Degrees; United Nations Fellowships; Swedish Institute Scholarships; Government of Ireland International Education Scholarship,1.0,1.0,1.0,1,1.0,1.0,1,1.0,0.3333333333333333,1,1.0,0.2,1,1.0,0.1,1,1.0,0.06666666666666667
metadata_aware_hybrid_rag_k5,5,Which scholarships are fully funded for Mongolian students?,Australia Awards; Chevening Scholarship; Fulbright U.S. Student Program; Global Korea Scholarship; MEXT Scholarship; Stipendium Hungaricum; Swiss Government Excellence Scholarships; Türkiye Scholarships,Chevening Scholarship; Swiss Government Excellence Scholarships,Chevening Scholarship; ADB Internship Program; Google Generation Scholarship; Boren Awards; Swiss Government Excellence Scholarships,1.0,0.25,0.4,1,0.125,1.0,1,0.125,0.3333333333333333,1,0.25,0.4,1,0.25,0.2,1,0.25,0.13333333333333333
metadata_aware_hybrid_rag_k5,5,Which scholarships require English proficiency for Mongolian students?,Australia Awards; Chevening Scholarship; Fulbright U.S. Student Program; Gates Cambridge Scholarship; Rhodes Scholarship,Australia Awards; Chevening Scholarship; Government of Ireland International Education Scholarship; Swedish Institute Scholarships,Commonwealth Scholarship and Fellowship Plan; Australia Awards; Government of Ireland International Education Scholarship; Swedish Institute Scholarships; Chevening Scholarship,0.5,0.4,0.4444444444444445,0,0.0,0.0,1,0.2,0.3333333333333333,1,0.4,0.4,1,0.4,0.2,1,0.4,0.13333333333333333
metadata_aware_hybrid_rag_k5,5,Which scholarships are master's programs for Mongolian students?,Australia Awards; Chevening Scholarship; Erasmus Mundus Joint Master Degrees; Gates Cambridge Scholarship; Rhodes Scholarship,Australia Awards; Erasmus Mundus Joint Master Degrees; Joint Japan/World Bank Graduate Scholarship Program; Swedish Institute Scholarships,Erasmus Mundus Joint Master Degrees; Swiss Government Excellence Scholarships; Joint Japan/World Bank Graduate Scholarship Program; Swedish Institute Scholarships; Australia Awards,0.5,0.4,0.4444444444444445,1,0.2,1.0,1,0.2,0.3333333333333333,1,0.4,0.4,1,0.4,0.2,1,0.4,0.13333333333333333
metadata_aware_hybrid_rag_k5,5,Which scholarships are PhD programs available to Mongolian students?,DAAD Scholarships; Gates Cambridge Scholarship; Vanier Canada Graduate Scholarships,DAAD Scholarships; Gates Cambridge Scholarship; Global Korea Scholarship; Knight-Hennessy Scholars; Rhodes Scholarship; Swiss Government Excellence Scholarships; Vanier Canada Graduate Scholarships,Swiss Government Excellence Scholarships; Vanier Canada Graduate Scholarships; DAAD Scholarships; Eiffel Excellence Scholarship Program; Commonwealth Scholarship and Fellowship Plan; Government of Ireland International Education Scholarship; Türkiye Scholarships; Chinese Government Scholarship; NSF Graduate Research Fellowship Program; Global Korea Scholarship; Knight-Hennessy Scholars; Stipendium Hungaricum; Gates Cambridge Scholarship; Erasmus Mundus Joint Master Degrees; Rhodes Scholarship,0.42857142857142855,1.0,0.6,0,0.0,0.0,1,0.6666666666666666,0.6666666666666666,1,0.6666666666666666,0.4,1,0.6666666666666666,0.2,1,1.0,0.2
metadata_aware_hybrid_rag_k5,5,Which scholarships are in Asia and available to Mongolian students?,Chinese Government Scholarship; Global Korea Scholarship; MEXT Scholarship; Türkiye Scholarships,Asian Development Bank–Japan Scholarship Program; Australia Awards; Chinese Government Scholarship; Global Korea Scholarship; JICA Scholarships; Japan-IMF Scholarship Program for Asia; Joint Japan/World Bank Graduate Scholarship Program; MEXT Scholarship; Schwarzman Scholars,Japan-IMF Scholarship Program for Asia; Asian Development Bank–Japan Scholarship Program; Joint Japan/World Bank Graduate Scholarship Program; Google Generation Scholarship; JICA Scholarships; Global Korea Scholarship; Chinese Government Scholarship; Schwarzman Scholars; MEXT Scholarship; Türkiye Scholarships; ADB Internship Program; Swiss Government Excellence Scholarships; Australia Awards; Government of Ireland International Education Scholarship; United Nations Fellowships,0.3333333333333333,0.75,0.46153846153846156,0,0.0,0.0,0,0.0,0.0,0,0.0,0.0,1,1.0,0.4,1,1.0,0.26666666666666666
metadata_aware_hybrid_rag_k5,5,Which scholarships are offered in Europe to Mongolian students?,Chevening Scholarship; DAAD Scholarships; Eiffel Excellence Scholarship Program; Erasmus Mundus Joint Master Degrees; Stipendium Hungaricum; Swedish Institute Scholarships,DAAD Scholarships; Eiffel Excellence Scholarship Program; Erasmus Mundus Joint Master Degrees; Stipendium Hungaricum; Swiss Government Excellence Scholarships,Erasmus Mundus Joint Master Degrees; Swiss Government Excellence Scholarships; Eiffel Excellence Scholarship Program; DAAD Scholarships; Stipendium Hungaricum,0.8,0.6666666666666666,0.7272727272727272,1,0.16666666666666666,1.0,1,0.3333333333333333,0.6666666666666666,1,0.6666666666666666,0.8,1,0.6666666666666666,0.4,1,0.6666666666666666,0.26666666666666666
metadata_aware_hybrid_rag_k5,5,Which scholarships are funded by governments and open to Mongolian students?,Australia Awards; Chevening Scholarship; Chinese Government Scholarship; Fulbright U.S. Student Program; Global Korea Scholarship; MEXT Scholarship,Australia Awards; DAAD Scholarships; Swiss Government Excellence Scholarships,Swiss Government Excellence Scholarships; Australia Awards; Boren Awards; DAAD Scholarships; Fulbright U.S. Student Program,0.3333333333333333,0.16666666666666666,0.2222222222222222,0,0.0,0.0,1,0.16666666666666666,0.3333333333333333,1,0.3333333333333333,0.4,1,0.3333333333333333,0.2,1,0.3333333333333333,0.13333333333333333
metadata_aware_hybrid_rag_k5,5,Which scholarships support development or public policy for Mongolian students?,Asian Development Bank–Japan Scholarship Program; Australia Awards; Joint Japan/World Bank Graduate Scholarship Program,Australia Awards; DAAD Scholarships,Swiss Government Excellence Scholarships; Commonwealth Scholarship and Fellowship Plan; Australia Awards; Swedish Institute Scholarships; DAAD Scholarships,0.5,0.3333333333333333,0.4,0,0.0,0.0,1,0.3333333333333333,0.3333333333333333,1,0.3333333333333333,0.2,1,0.3333333333333333,0.1,1,0.3333333333333333,0.06666666666666667
metadata_aware_hybrid_rag_k5,5,Which scholarships include leadership programs for Mongolian students?,Chevening Scholarship; Knight-Hennessy Scholars; Rotary Peace Fellowship; Schwarzman Scholars,Chevening Scholarship; Türkiye Scholarships,Boren Awards; United Nations Fellowships; Erasmus Mundus Joint Master Degrees; Chevening Scholarship; Türkiye Scholarships,0.5,0.25,0.3333333333333333,0,0.0,0.0,0,0.0,0.0,1,0.25,0.2,1,0.25,0.1,1,0.25,0.06666666666666667
metadata_aware_hybrid_rag_k5,5,Which scholarships are university-based and open to Mongolian students?,Gates Cambridge Scholarship; Knight-Hennessy Scholars; Schwarzman Scholars,NONE,Swiss Government Excellence Scholarships; Erasmus Mundus Joint Master Degrees; Australia Awards; Swedish Institute Scholarships; DAAD Scholarships,0.0,0.0,0.0,0,0.0,0.0,0,0.0,0.0,0,0.0,0.0,0,0.0,0.0,0,0.0,0.0
metadata_aware_hybrid_rag_k5,5,Which scholarships do not require Japanese language for Mongolian students?,MEXT Scholarship,Asian Development Bank–Japan Scholarship Program; Japan-IMF Scholarship Program for Asia; Joint Japan/World Bank Graduate Scholarship Program,Japan-IMF Scholarship Program for Asia; MEXT Scholarship; JICA Scholarships; Joint Japan/World Bank Graduate Scholarship Program; Asian Development Bank–Japan Scholarship Program,0.0,0.0,0.0,0,0.0,0.0,1,1.0,0.3333333333333333,1,1.0,0.2,1,1.0,0.1,1,1.0,0.06666666666666667
metadata_aware_hybrid_rag_k5,5,Which scholarships are partially funded for Mongolian students?,AAUW International Fellowships; Google Generation Scholarship,AAUW International Fellowships; Eiffel Excellence Scholarship Program; Government of Ireland International Education Scholarship,Boren Awards; Benjamin A. Gilman International Scholarship; Government of Ireland International Education Scholarship; Eiffel Excellence Scholarship Program; AAUW International Fellowships,0.3333333333333333,0.5,0.4,0,0.0,0.0,0,0.0,0.0,1,0.5,0.2,1,0.5,0.1,1,0.5,0.06666666666666667
metadata_aware_hybrid_rag_k5,5,Which scholarships are international joint programs for Mongolian students?,Erasmus Mundus Joint Master Degrees,Erasmus Mundus Joint Master Degrees; Joint Japan/World Bank Graduate Scholarship Program,Joint Japan/World Bank Graduate Scholarship Program; Erasmus Mundus Joint Master Degrees; Swiss Government Excellence Scholarships; Boren Awards; Swedish Institute Scholarships,0.5,1.0,0.6666666666666666,0,0.0,0.0,1,1.0,0.3333333333333333,1,1.0,0.2,1,1.0,0.1,1,1.0,0.06666666666666667
metadata_aware_hybrid_rag_k5,5,Which scholarships are short-term or fellowship programs for Mongolian students?,Rotary Peace Fellowship; United Nations Fellowships,AAUW International Fellowships; United Nations Fellowships,AAUW International Fellowships; NSF Graduate Research Fellowship Program; Commonwealth Scholarship and Fellowship Plan; United Nations Fellowships; Boren Awards,0.5,0.5,0.5,0,0.0,0.0,0,0.0,0.0,1,0.5,0.2,1,0.5,0.1,1,0.5,0.06666666666666667
metadata_aware_hybrid_rag_k5,5,Which scholarships focus on research degrees for Mongolian students?,DAAD Scholarships; Vanier Canada Graduate Scholarships,DAAD Scholarships; Swiss Government Excellence Scholarships; Türkiye Scholarships,Swiss Government Excellence Scholarships; Commonwealth Scholarship and Fellowship Plan; DAAD Scholarships; Erasmus Mundus Joint Master Degrees; Türkiye Scholarships,0.3333333333333333,0.5,0.4,0,0.0,0.0,1,0.5,0.3333333333333333,1,0.5,0.2,1,0.5,0.1,1,0.5,0.06666666666666667
metadata_aware_hybrid_rag_k5,5,Which fully funded master's scholarships are available to Mongolian students in the UK?,Chevening Scholarship; Gates Cambridge Scholarship; Rhodes Scholarship,Australia Awards; Chevening Scholarship; Gates Cambridge Scholarship,Chevening Scholarship; Marshall Scholarship; Churchill Scholarship; Commonwealth Scholarship and Fellowship Plan; Google Generation Scholarship; Gates Cambridge Scholarship; Rhodes Scholarship; ADB Internship Program; Erasmus Mundus Joint Master Degrees; Government of Ireland International Education Scholarship; DAAD Scholarships; Asian Development Bank–Japan Scholarship Program; Knight-Hennessy Scholars; Australia Awards; Swedish Institute Scholarships,0.6666666666666666,0.6666666666666666,0.6666666666666666,1,0.3333333333333333,1.0,1,0.3333333333333333,0.3333333333333333,1,0.3333333333333333,0.2,1,1.0,0.3,1,1.0,0.2
metadata_aware_hybrid_rag_k5,5,Which scholarships are fully funded and available to Mongolian students in Japan?,Asian Development Bank–Japan Scholarship Program; MEXT Scholarship,JICA Scholarships; Japan-IMF Scholarship Program for Asia; MEXT Scholarship,MEXT Scholarship; JICA Scholarships; Joint Japan/World Bank Graduate Scholarship Program; Google Generation Scholarship; Asian Development Bank–Japan Scholarship Program; Japan-IMF Scholarship Program for Asia; ADB Internship Program; Global Korea Scholarship; Chinese Government Scholarship; Schwarzman Scholars; Chevening Scholarship; Türkiye Scholarships; Government of Ireland International Education Scholarship; Churchill Scholarship; Australia Awards,0.3333333333333333,0.5,0.4,1,0.5,1.0,1,0.5,0.3333333333333333,1,1.0,0.4,1,1.0,0.2,1,1.0,0.13333333333333333
metadata_aware_hybrid_rag_k5,5,Which scholarships require work experience for Mongolian students?,Australia Awards; Chevening Scholarship; Fulbright U.S. Student Program; Joint Japan/World Bank Graduate Scholarship Program,NONE,Australia Awards; Rotary Peace Fellowship; Joint Japan/World Bank Graduate Scholarship Program; Swedish Institute Scholarships; ADB Internship Program,0.0,0.0,0.0,1,0.25,1.0,1,0.5,0.6666666666666666,1,0.5,0.4,1,0.5,0.2,1,0.5,0.13333333333333333
metadata_aware_hybrid_rag_k5,5,Which scholarships are fully funded and available to Mongolian students in Europe?,Chevening Scholarship; Erasmus Mundus Joint Master Degrees; Gates Cambridge Scholarship; Stipendium Hungaricum,Chevening Scholarship; DAAD Scholarships; Erasmus Mundus Joint Master Degrees; Stipendium Hungaricum; Swedish Institute Scholarships; Swiss Government Excellence Scholarships,Erasmus Mundus Joint Master Degrees; DAAD Scholarships; Swiss Government Excellence Scholarships; Eiffel Excellence Scholarship Program; Chevening Scholarship; Google Generation Scholarship; Stipendium Hungaricum; ADB Internship Program; Government of Ireland International Education Scholarship; Swedish Institute Scholarships; Churchill Scholarship; Chinese Government Scholarship; Marshall Scholarship; Vanier Canada Graduate Scholarships; Knight-Hennessy Scholars,0.5,0.75,0.6,1,0.25,1.0,1,0.25,0.3333333333333333,1,0.5,0.4,1,0.75,0.3,1,0.75,0.2
metadata_aware_hybrid_rag_k5,5,Which scholarships are fully funded and require English for Mongolian students?,Australia Awards; Chevening Scholarship; Fulbright U.S. Student Program; Gates Cambridge Scholarship; Rhodes Scholarship,Chevening Scholarship,Chevening Scholarship; ADB Internship Program; Google Generation Scholarship; The Gates Scholarship; Fulbright U.S. Student Program,1.0,0.2,0.33333333333333337,1,0.2,1.0,1,0.2,0.3333333333333333,1,0.4,0.4,1,0.4,0.2,1,0.4,0.13333333333333333
metadata_aware_hybrid_rag_k5,5,Which scholarships are fully funded and located in Asia for Mongolian students?,Chinese Government Scholarship; Global Korea Scholarship; MEXT Scholarship; Türkiye Scholarships,Japan-IMF Scholarship Program for Asia; Joint Japan/World Bank Graduate Scholarship Program,Google Generation Scholarship; ADB Internship Program; Japan-IMF Scholarship Program for Asia; Joint Japan/World Bank Graduate Scholarship Program; Chevening Scholarship,0.0,0.0,0.0,0,0.0,0.0,0,0.0,0.0,0,0.0,0.0,0,0.0,0.0,0,0.0,0.0
metadata_aware_hybrid_rag_k5,5,Which scholarships are fully funded and require work experience for Mongolian students?,Australia Awards; Chevening Scholarship; Fulbright U.S. Student Program,NONE,ADB Internship Program; Chevening Scholarship; Australia Awards; Joint Japan/World Bank Graduate Scholarship Program; Swedish Institute Scholarships,0.0,0.0,0.0,0,0.0,0.0,1,0.6666666666666666,0.6666666666666666,1,0.6666666666666666,0.4,1,0.6666666666666666,0.2,1,0.6666666666666666,0.13333333333333333
metadata_aware_hybrid_rag_k5,5,Which scholarships are for development-related master's programs for Mongolian students?,Asian Development Bank–Japan Scholarship Program; Australia Awards; Joint Japan/World Bank Graduate Scholarship Program,DAAD Scholarships; Erasmus Mundus Joint Master Degrees; Joint Japan/World Bank Graduate Scholarship Program,Erasmus Mundus Joint Master Degrees; Swiss Government Excellence Scholarships; Joint Japan/World Bank Graduate Scholarship Program; DAAD Scholarships; Swedish Institute Scholarships,0.3333333333333333,0.3333333333333333,0.3333333333333333,0,0.0,0.0,1,0.3333333333333333,0.3333333333333333,1,0.3333333333333333,0.2,1,0.3333333333333333,0.1,1,0.3333333333333333,0.06666666666666667
metadata_aware_hybrid_rag_k5,5,Which scholarships are leadership-focused and fully funded for Mongolian students?,Chevening Scholarship; Knight-Hennessy Scholars; Schwarzman Scholars,Chevening Scholarship,Chevening Scholarship; ADB Internship Program; Google Generation Scholarship; Boren Awards; Swiss Government Excellence Scholarships,1.0,0.3333333333333333,0.5,1,0.3333333333333333,1.0,1,0.3333333333333333,0.3333333333333333,1,0.3333333333333333,0.2,1,0.3333333333333333,0.1,1,0.3333333333333333,0.06666666666666667
metadata_aware_hybrid_rag_k5,5,Which scholarships are fully funded PhD opportunities for Mongolian students?,DAAD Scholarships; Gates Cambridge Scholarship; Vanier Canada Graduate Scholarships,NONE,Chevening Scholarship; Swiss Government Excellence Scholarships; Türkiye Scholarships; DAAD Scholarships; Eiffel Excellence Scholarship Program,0.0,0.0,0.0,0,0.0,0.0,0,0.0,0.0,1,0.3333333333333333,0.2,1,0.3333333333333333,0.1,1,0.3333333333333333,0.06666666666666667
metadata_aware_hybrid_rag_k5,5,Which scholarships involve multiple universities or countries and are open to Mongolian students?,Erasmus Mundus Joint Master Degrees,Asian Development Bank–Japan Scholarship Program; Erasmus Mundus Joint Master Degrees,Swiss Government Excellence Scholarships; Erasmus Mundus Joint Master Degrees; Chinese Government Scholarship; Asian Development Bank–Japan Scholarship Program; Swedish Institute Scholarships,0.5,1.0,0.6666666666666666,0,0.0,0.0,1,1.0,0.3333333333333333,1,1.0,0.2,1,1.0,0.1,1,1.0,0.06666666666666667
metadata_aware_hybrid_rag_k5,5,Which scholarships require both English and work experience for Mongolian students?,Australia Awards; Chevening Scholarship; Fulbright U.S. Student Program,Joint Japan/World Bank Graduate Scholarship Program; Rotary Peace Fellowship,Australia Awards; Swedish Institute Scholarships; Joint Japan/World Bank Graduate Scholarship Program; Rotary Peace Fellowship; Fulbright U.S. Student Program,0.0,0.0,0.0,1,0.3333333333333333,1.0,1,0.3333333333333333,0.3333333333333333,1,0.6666666666666666,0.4,1,0.6666666666666666,0.2,1,0.6666666666666666,0.13333333333333333
metadata_aware_hybrid_rag_k5,5,Which scholarships are fully funded but may have strict eligibility requirements for Mongolian students?,Gates Cambridge Scholarship; Rhodes Scholarship; Schwarzman Scholars,Chevening Scholarship; Chinese Government Scholarship; Swiss Government Excellence Scholarships,Chevening Scholarship; ADB Internship Program; Google Generation Scholarship; Chinese Government Scholarship; Swiss Government Excellence Scholarships,0.0,0.0,0.0,0,0.0,0.0,0,0.0,0.0,0,0.0,0.0,0,0.0,0.0,0,0.0,0.0
metadata_aware_hybrid_rag_k5,5,Which scholarships combine funding and leadership development for Mongolian students?,Chevening Scholarship; Knight-Hennessy Scholars; Schwarzman Scholars,Australia Awards; Chevening Scholarship; Knight-Hennessy Scholars,Knight-Hennessy Scholars; Boren Awards; Australia Awards; United Nations Fellowships; Chevening Scholarship,0.6666666666666666,0.6666666666666666,0.6666666666666666,1,0.3333333333333333,1.0,1,0.3333333333333333,0.3333333333333333,1,0.6666666666666666,0.4,1,0.6666666666666666,0.2,1,0.6666666666666666,0.13333333333333333
metadata_aware_hybrid_rag_k5,5,Which scholarships are fully funded and competitive for top students from Mongolia?,Gates Cambridge Scholarship; Rhodes Scholarship; Schwarzman Scholars,Chevening Scholarship,Chevening Scholarship; ADB Internship Program; Google Generation Scholarship; Eiffel Excellence Scholarship Program; Commonwealth Scholarship and Fellowship Plan,0.0,0.0,0.0,0,0.0,0.0,0,0.0,0.0,0,0.0,0.0,0,0.0,0.0,0,0.0,0.0
