system,k,question,expected,answer,retrieved,precision,recall,f1,hit_at_1,retrieval_recall_at_1,retrieval_precision_at_1,hit_at_3,retrieval_recall_at_3,retrieval_precision_at_3,hit_at_5,retrieval_recall_at_5,retrieval_precision_at_5,hit_at_10,retrieval_recall_at_10,retrieval_precision_at_10,hit_at_15,retrieval_recall_at_15,retrieval_precision_at_15
metadata_aware_hybrid_rag_k15,15,Which scholarships require work experience for Mongolian students?,Australia Awards; Chevening Scholarship; Fulbright U.S. Student Program; Joint Japan/World Bank Graduate Scholarship Program,NONE,Australia Awards; Rotary Peace Fellowship; Joint Japan/World Bank Graduate Scholarship Program; Swedish Institute Scholarships; ADB Internship Program; Chevening Scholarship; Commonwealth Scholarship and Fellowship Plan; Swiss Government Excellence Scholarships; Fulbright U.S. Student Program; United Nations Fellowships; Erasmus Mundus Joint Master Degrees; Boren Awards; Türkiye Scholarships; DAAD Scholarships; Government of Ireland International Education Scholarship,0.0,0.0,0.0,1,0.25,1.0,1,0.5,0.6666666666666666,1,0.5,0.4,1,1.0,0.4,1,1.0,0.26666666666666666
metadata_aware_hybrid_rag_k15,15,Which scholarships are fully funded and available to Mongolian students in Europe?,Chevening Scholarship; Erasmus Mundus Joint Master Degrees; Gates Cambridge Scholarship; Stipendium Hungaricum,Chevening Scholarship; DAAD Scholarships; Erasmus Mundus Joint Master Degrees; Stipendium Hungaricum; Swedish Institute Scholarships; Swiss Government Excellence Scholarships,Erasmus Mundus Joint Master Degrees; DAAD Scholarships; Swiss Government Excellence Scholarships; Eiffel Excellence Scholarship Program; Chevening Scholarship; Google Generation Scholarship; Stipendium Hungaricum; ADB Internship Program; Government of Ireland International Education Scholarship; Swedish Institute Scholarships; Churchill Scholarship; Chinese Government Scholarship; Marshall Scholarship; Vanier Canada Graduate Scholarships; Knight-Hennessy Scholars,0.5,0.75,0.6,1,0.25,1.0,1,0.25,0.3333333333333333,1,0.5,0.4,1,0.75,0.3,1,0.75,0.2
metadata_aware_hybrid_rag_k15,15,Which scholarships are fully funded and require English for Mongolian students?,Australia Awards; Chevening Scholarship; Fulbright U.S. Student Program; Gates Cambridge Scholarship; Rhodes Scholarship,Australia Awards; Chevening Scholarship; Türkiye Scholarships,Chevening Scholarship; ADB Internship Program; Google Generation Scholarship; The Gates Scholarship; Fulbright U.S. Student Program; Government of Ireland International Education Scholarship; Türkiye Scholarships; Churchill Scholarship; Boren Awards; Marshall Scholarship; Swedish Institute Scholarships; Eiffel Excellence Scholarship Program; Commonwealth Scholarship and Fellowship Plan; DAAD Scholarships; Australia Awards,0.6666666666666666,0.4,0.5,1,0.2,1.0,1,0.2,0.3333333333333333,1,0.4,0.4,1,0.4,0.2,1,0.6,0.2
metadata_aware_hybrid_rag_k15,15,Which scholarships are fully funded and located in Asia for Mongolian students?,Chinese Government Scholarship; Global Korea Scholarship; MEXT Scholarship; Türkiye Scholarships,Asian Development Bank–Japan Scholarship Program; Chinese Government Scholarship; Global Korea Scholarship; JICA Scholarships; Japan-IMF Scholarship Program for Asia; MEXT Scholarship; Schwarzman Scholars; Türkiye Scholarships,Google Generation Scholarship; ADB Internship Program; Japan-IMF Scholarship Program for Asia; Joint Japan/World Bank Graduate Scholarship Program; Chevening Scholarship; JICA Scholarships; Asian Development Bank–Japan Scholarship Program; Chinese Government Scholarship; Schwarzman Scholars; MEXT Scholarship; Türkiye Scholarships; Global Korea Scholarship; The Gates Scholarship; Government of Ireland International Education Scholarship; Swiss Government Excellence Scholarships,0.5,1.0,0.6666666666666666,0,0.0,0.0,0,0.0,0.0,0,0.0,0.0,1,0.5,0.2,1,1.0,0.26666666666666666
metadata_aware_hybrid_rag_k15,15,Which scholarships are fully funded and require work experience for Mongolian students?,Australia Awards; Chevening Scholarship; Fulbright U.S. Student Program,NONE,ADB Internship Program; Chevening Scholarship; Australia Awards; Joint Japan/World Bank Graduate Scholarship Program; Swedish Institute Scholarships; Rotary Peace Fellowship; Google Generation Scholarship; Fulbright U.S. Student Program; Boren Awards; Swiss Government Excellence Scholarships; United Nations Fellowships; Erasmus Mundus Joint Master Degrees; The Gates Scholarship; Commonwealth Scholarship and Fellowship Plan; DAAD Scholarships,0.0,0.0,0.0,0,0.0,0.0,1,0.6666666666666666,0.6666666666666666,1,0.6666666666666666,0.4,1,1.0,0.3,1,1.0,0.2
metadata_aware_hybrid_rag_k15,15,Which scholarships are for development-related master's programs for Mongolian students?,Asian Development Bank–Japan Scholarship Program; Australia Awards; Joint Japan/World Bank Graduate Scholarship Program,Australia Awards; Chevening Scholarship; Joint Japan/World Bank Graduate Scholarship Program,Erasmus Mundus Joint Master Degrees; Swiss Government Excellence Scholarships; Joint Japan/World Bank Graduate Scholarship Program; DAAD Scholarships; Swedish Institute Scholarships; Australia Awards; Commonwealth Scholarship and Fellowship Plan; NSF Graduate Research Fellowship Program; Marshall Scholarship; Government of Ireland International Education Scholarship; Churchill Scholarship; Boren Awards; Eiffel Excellence Scholarship Program; Chevening Scholarship; Türkiye Scholarships,0.6666666666666666,0.6666666666666666,0.6666666666666666,0,0.0,0.0,1,0.3333333333333333,0.3333333333333333,1,0.3333333333333333,0.2,1,0.6666666666666666,0.2,1,0.6666666666666666,0.13333333333333333
metadata_aware_hybrid_rag_k15,15,Which scholarships are leadership-focused and fully funded for Mongolian students?,Chevening Scholarship; Knight-Hennessy Scholars; Schwarzman Scholars,Chevening Scholarship; Swedish Institute Scholarships; Türkiye Scholarships,Chevening Scholarship; ADB Internship Program; Google Generation Scholarship; Boren Awards; Swiss Government Excellence Scholarships; Swedish Institute Scholarships; Erasmus Mundus Joint Master Degrees; United Nations Fellowships; The Gates Scholarship; Benjamin A. Gilman International Scholarship; Commonwealth Scholarship and Fellowship Plan; Government of Ireland International Education Scholarship; Marshall Scholarship; Eiffel Excellence Scholarship Program; Türkiye Scholarships,0.3333333333333333,0.3333333333333333,0.3333333333333333,1,0.3333333333333333,1.0,1,0.3333333333333333,0.3333333333333333,1,0.3333333333333333,0.2,1,0.3333333333333333,0.1,1,0.3333333333333333,0.06666666666666667
metadata_aware_hybrid_rag_k15,15,Which scholarships are fully funded PhD opportunities for Mongolian students?,DAAD Scholarships; Gates Cambridge Scholarship; Vanier Canada Graduate Scholarships,NONE,Chevening Scholarship; Swiss Government Excellence Scholarships; Türkiye Scholarships; DAAD Scholarships; Eiffel Excellence Scholarship Program; Government of Ireland International Education Scholarship; Commonwealth Scholarship and Fellowship Plan; Stipendium Hungaricum; NSF Graduate Research Fellowship Program; ADB Internship Program; Chinese Government Scholarship; Vanier Canada Graduate Scholarships; Knight-Hennessy Scholars; MEXT Scholarship; Global Korea Scholarship,0.0,0.0,0.0,0,0.0,0.0,0,0.0,0.0,1,0.3333333333333333,0.2,1,0.3333333333333333,0.1,1,0.6666666666666666,0.13333333333333333
metadata_aware_hybrid_rag_k15,15,Which scholarships involve multiple universities or countries and are open to Mongolian students?,Erasmus Mundus Joint Master Degrees,Asian Development Bank–Japan Scholarship Program; Erasmus Mundus Joint Master Degrees; Global Korea Scholarship; Japan-IMF Scholarship Program for Asia; Joint Japan/World Bank Graduate Scholarship Program; MEXT Scholarship,Swiss Government Excellence Scholarships; Erasmus Mundus Joint Master Degrees; Chinese Government Scholarship; Asian Development Bank–Japan Scholarship Program; Swedish Institute Scholarships; Commonwealth Scholarship and Fellowship Plan; Knight-Hennessy Scholars; Australia Awards; Joint Japan/World Bank Graduate Scholarship Program; Global Korea Scholarship; MEXT Scholarship; Benjamin A. Gilman International Scholarship; DAAD Scholarships; Stipendium Hungaricum; Japan-IMF Scholarship Program for Asia,0.16666666666666666,1.0,0.2857142857142857,0,0.0,0.0,1,1.0,0.3333333333333333,1,1.0,0.2,1,1.0,0.1,1,1.0,0.06666666666666667
metadata_aware_hybrid_rag_k15,15,Which scholarships require both English and work experience for Mongolian students?,Australia Awards; Chevening Scholarship; Fulbright U.S. Student Program,NONE,Australia Awards; Swedish Institute Scholarships; Joint Japan/World Bank Graduate Scholarship Program; Rotary Peace Fellowship; Fulbright U.S. Student Program; Commonwealth Scholarship and Fellowship Plan; ADB Internship Program; Chevening Scholarship; Türkiye Scholarships; Government of Ireland International Education Scholarship; United Nations Fellowships; Vanier Canada Graduate Scholarships; DAAD Scholarships; Chinese Government Scholarship; The Gates Scholarship,0.0,0.0,0.0,1,0.3333333333333333,1.0,1,0.3333333333333333,0.3333333333333333,1,0.6666666666666666,0.4,1,1.0,0.3,1,1.0,0.2
metadata_aware_hybrid_rag_k15,15,Which scholarships are fully funded but may have strict eligibility requirements for Mongolian students?,Gates Cambridge Scholarship; Rhodes Scholarship; Schwarzman Scholars,Australia Awards; Chevening Scholarship; Chinese Government Scholarship; Joint Japan/World Bank Graduate Scholarship Program; Türkiye Scholarships,Chevening Scholarship; ADB Internship Program; Google Generation Scholarship; Chinese Government Scholarship; Swiss Government Excellence Scholarships; DAAD Scholarships; Government of Ireland International Education Scholarship; Benjamin A. Gilman International Scholarship; Swedish Institute Scholarships; Türkiye Scholarships; Erasmus Mundus Joint Master Degrees; Australia Awards; AAUW International Fellowships; Eiffel Excellence Scholarship Program; Joint Japan/World Bank Graduate Scholarship Program,0.0,0.0,0.0,0,0.0,0.0,0,0.0,0.0,0,0.0,0.0,0,0.0,0.0,0,0.0,0.0
metadata_aware_hybrid_rag_k15,15,Which scholarships combine funding and leadership development for Mongolian students?,Chevening Scholarship; Knight-Hennessy Scholars; Schwarzman Scholars,Australia Awards; Chevening Scholarship; Joint Japan/World Bank Graduate Scholarship Program; Knight-Hennessy Scholars; Türkiye Scholarships,Knight-Hennessy Scholars; Boren Awards; Australia Awards; United Nations Fellowships; Chevening Scholarship; DAAD Scholarships; Swiss Government Excellence Scholarships; AAUW International Fellowships; Commonwealth Scholarship and Fellowship Plan; Swedish Institute Scholarships; ADB Internship Program; Erasmus Mundus Joint Master Degrees; Joint Japan/World Bank Graduate Scholarship Program; Japan-IMF Scholarship Program for Asia; Türkiye Scholarships,0.4,0.6666666666666666,0.5,1,0.3333333333333333,1.0,1,0.3333333333333333,0.3333333333333333,1,0.6666666666666666,0.4,1,0.6666666666666666,0.2,1,0.6666666666666666,0.13333333333333333
metadata_aware_hybrid_rag_k15,15,Which scholarships are fully funded and competitive for top students from Mongolia?,Gates Cambridge Scholarship; Rhodes Scholarship; Schwarzman Scholars,Chevening Scholarship; Erasmus Mundus Joint Master Degrees; Knight-Hennessy Scholars; Swedish Institute Scholarships; Swiss Government Excellence Scholarships,Chevening Scholarship; ADB Internship Program; Google Generation Scholarship; Eiffel Excellence Scholarship Program; Commonwealth Scholarship and Fellowship Plan; Government of Ireland International Education Scholarship; Swiss Government Excellence Scholarships; Swedish Institute Scholarships; Boren Awards; New Zealand Scholarships; Erasmus Mundus Joint Master Degrees; United Nations Fellowships; The Gates Scholarship; Knight-Hennessy Scholars; Churchill Scholarship,0.0,0.0,0.0,0,0.0,0.0,0,0.0,0.0,0,0.0,0.0,0,0.0,0.0,0,0.0,0.0
metadata_aware_hybrid_rag_k15,15,Which scholarships are NOT available to Mongolian students?,Benjamin A. Gilman International Scholarship; Boren Awards; Churchill Scholarship; George J. Mitchell Scholarship; Marshall Scholarship,Benjamin A. Gilman International Scholarship; Boren Awards; Churchill Scholarship; Commonwealth Scholarship and Fellowship Plan; Fulbright U.S. Student Program; George J. Mitchell Scholarship; Marshall Scholarship; The Gates Scholarship,Boren Awards; Erasmus Mundus Joint Master Degrees; Vanier Canada Graduate Scholarships; Benjamin A. Gilman International Scholarship; Marshall Scholarship; Commonwealth Scholarship and Fellowship Plan; Swiss Government Excellence Scholarships; Fulbright U.S. Student Program; Swedish Institute Scholarships; AAUW International Fellowships; Churchill Scholarship; United Nations Fellowships; George J. Mitchell Scholarship; Eiffel Excellence Scholarship Program; The Gates Scholarship,0.625,1.0,0.7692307692307693,1,0.2,1.0,1,0.2,0.3333333333333333,1,0.6,0.6,1,0.6,0.3,1,1.0,0.3333333333333333
metadata_aware_hybrid_rag_k15,15,Which scholarships have conditional eligibility for Mongolian students?,Mastercard Foundation Scholars Program; NSF Graduate Research Fellowship Program; Rhodes Scholarship; The Gates Scholarship,AAUW International Fellowships; Australia Awards; Chinese Government Scholarship; DAAD Scholarships; Eiffel Excellence Scholarship Program; Erasmus Mundus Joint Master Degrees; Government of Ireland International Education Scholarship; MEXT Scholarship; New Zealand Scholarships; Stipendium Hungaricum; Swedish Institute Scholarships; The Gates Scholarship; Türkiye Scholarships; United Nations Fellowships,Swiss Government Excellence Scholarships; New Zealand Scholarships; Türkiye Scholarships; Chinese Government Scholarship; AAUW International Fellowships; Australia Awards; Swedish Institute Scholarships; Erasmus Mundus Joint Master Degrees; United Nations Fellowships; Stipendium Hungaricum; Government of Ireland International Education Scholarship; The Gates Scholarship; DAAD Scholarships; Eiffel Excellence Scholarship Program; MEXT Scholarship,0.07142857142857142,0.25,0.11111111111111112,0,0.0,0.0,0,0.0,0.0,0,0.0,0.0,0,0.0,0.0,1,0.25,0.06666666666666667
metadata_aware_hybrid_rag_k15,15,Which scholarships require checking eligibility for Mongolian applicants?,JICA Scholarships; Mastercard Foundation Scholars Program; New Zealand Scholarships; Rhodes Scholarship,AAUW International Fellowships; ADB Internship Program; Asian Development Bank–Japan Scholarship Program; Australia Awards; Benjamin A. Gilman International Scholarship; Boren Awards; Chevening Scholarship; Chinese Government Scholarship; Churchill Scholarship; Commonwealth Scholarship and Fellowship Plan; DAAD Scholarships; Eiffel Excellence Scholarship Program; Erasmus Mundus Joint Master Degrees; Fulbright U.S. Student Program; Gates Cambridge Scholarship; George J. Mitchell Scholarship; Global Korea Scholarship; Google Generation Scholarship; Government of Ireland International Education Scholarship; JICA Scholarships; Japan-IMF Scholarship Program for Asia; Joint Japan/World Bank Graduate Scholarship Program; Knight-Hennessy Scholars; Marshall Scholarship; Mastercard Foundation Scholars Program; NSF Graduate Research Fellowship Program; New Zealand Scholarships; Orange Knowledge Programme; Rhodes Scholarship; Rotary Peace Fellowship; Schwarzman Scholars; Stipendium Hungaricum; Swedish Institute Scholarships; Swiss Government Excellence Scholarships; The Gates Scholarship; Türkiye Scholarships; United Nations Fellowships; Vanier Canada Graduate Scholarships,Swiss Government Excellence Scholarships; Australia Awards; Swedish Institute Scholarships; United Nations Fellowships; Erasmus Mundus Joint Master Degrees; Government of Ireland International Education Scholarship; Chevening Scholarship; Türkiye Scholarships; DAAD Scholarships; Chinese Government Scholarship; Fulbright U.S. Student Program; Commonwealth Scholarship and Fellowship Plan; The Gates Scholarship; Boren Awards; Stipendium Hungaricum,0.10526315789473684,1.0,0.1904761904761905,0,0.0,0.0,0,0.0,0.0,0,0.0,0.0,0,0.0,0.0,0,0.0,0.0
metadata_aware_hybrid_rag_k15,15,Which scholarships are likely but not guaranteed for Mongolian students?,DAAD Scholarships; Erasmus Mundus Joint Master Degrees; Orange Knowledge Programme,AAUW International Fellowships; Eiffel Excellence Scholarship Program; Erasmus Mundus Joint Master Degrees; Government of Ireland International Education Scholarship; Swedish Institute Scholarships; Swiss Government Excellence Scholarships; United Nations Fellowships,Benjamin A. Gilman International Scholarship; Swiss Government Excellence Scholarships; Swedish Institute Scholarships; Boren Awards; Marshall Scholarship; Erasmus Mundus Joint Master Degrees; AAUW International Fellowships; George J. Mitchell Scholarship; Eiffel Excellence Scholarship Program; NSF Graduate Research Fellowship Program; United Nations Fellowships; Commonwealth Scholarship and Fellowship Plan; Fulbright U.S. Student Program; The Gates Scholarship; Government of Ireland International Education Scholarship,0.14285714285714285,0.3333333333333333,0.2,0,0.0,0.0,0,0.0,0.0,0,0.0,0.0,1,0.3333333333333333,0.1,1,0.3333333333333333,0.06666666666666667
metadata_aware_hybrid_rag_k15,15,Which scholarships are restricted by citizenship and exclude Mongolian applicants?,Churchill Scholarship; George J. Mitchell Scholarship; Marshall Scholarship,Benjamin A. Gilman International Scholarship; Boren Awards; Churchill Scholarship; Fulbright U.S. Student Program; George J. Mitchell Scholarship; Marshall Scholarship; NSF Graduate Research Fellowship Program; The Gates Scholarship,Marshall Scholarship; The Gates Scholarship; Benjamin A. Gilman International Scholarship; NSF Graduate Research Fellowship Program; Boren Awards; Swiss Government Excellence Scholarships; Fulbright U.S. Student Program; United Nations Fellowships; Erasmus Mundus Joint Master Degrees; Commonwealth Scholarship and Fellowship Plan; Churchill Scholarship; George J. Mitchell Scholarship; Swedish Institute Scholarships; Vanier Canada Graduate Scholarships; DAAD Scholarships,0.375,1.0,0.5454545454545454,1,0.3333333333333333,1.0,1,0.3333333333333333,0.3333333333333333,1,0.3333333333333333,0.2,1,0.3333333333333333,0.1,1,1.0,0.2
metadata_aware_hybrid_rag_k15,15,Which scholarships depend on partner universities for Mongolian students?,Erasmus Mundus Joint Master Degrees; Mastercard Foundation Scholars Program,NONE,Commonwealth Scholarship and Fellowship Plan; Erasmus Mundus Joint Master Degrees; Swiss Government Excellence Scholarships; Stipendium Hungaricum; Government of Ireland International Education Scholarship; Boren Awards; DAAD Scholarships; Türkiye Scholarships; MEXT Scholarship; Mastercard Foundation Scholars Program; Chinese Government Scholarship; Fulbright U.S. Student Program; United Nations Fellowships; Swedish Institute Scholarships; AAUW International Fellowships,0.0,0.0,0.0,0,0.0,0.0,1,0.5,0.3333333333333333,1,0.5,0.2,1,1.0,0.2,1,1.0,0.13333333333333333
metadata_aware_hybrid_rag_k15,15,Which scholarships are not fully funded for Mongolian students?,AAUW International Fellowships; Eiffel Excellence Scholarship Program; Google Generation Scholarship,AAUW International Fellowships; ADB Internship Program; Benjamin A. Gilman International Scholarship; Eiffel Excellence Scholarship Program; Google Generation Scholarship; The Gates Scholarship,Chevening Scholarship; ADB Internship Program; Google Generation Scholarship; Boren Awards; The Gates Scholarship; Benjamin A. Gilman International Scholarship; Commonwealth Scholarship and Fellowship Plan; Marshall Scholarship; Swiss Government Excellence Scholarships; Swedish Institute Scholarships; Churchill Scholarship; Fulbright U.S. Student Program; Eiffel Excellence Scholarship Program; AAUW International Fellowships; Erasmus Mundus Joint Master Degrees,0.5,1.0,0.6666666666666666,0,0.0,0.0,1,0.3333333333333333,0.3333333333333333,1,0.3333333333333333,0.2,1,0.3333333333333333,0.1,1,1.0,0.2
metadata_aware_hybrid_rag_k15,15,Which scholarships provide only partial funding for Mongolian students?,AAUW International Fellowships; Google Generation Scholarship,AAUW International Fellowships; DAAD Scholarships; Eiffel Excellence Scholarship Program; Government of Ireland International Education Scholarship; Swedish Institute Scholarships,Boren Awards; AAUW International Fellowships; Government of Ireland International Education Scholarship; Stipendium Hungaricum; Benjamin A. Gilman International Scholarship; Eiffel Excellence Scholarship Program; United Nations Fellowships; Australia Awards; DAAD Scholarships; The Gates Scholarship; Swiss Government Excellence Scholarships; Knight-Hennessy Scholars; NSF Graduate Research Fellowship Program; Türkiye Scholarships; Swedish Institute Scholarships,0.2,0.5,0.28571428571428575,0,0.0,0.0,1,0.5,0.3333333333333333,1,0.5,0.2,1,0.5,0.1,1,0.5,0.06666666666666667
metadata_aware_hybrid_rag_k15,15,Which scholarships require nomination or government selection for Mongolian students?,JICA Scholarships; Joint Japan/World Bank Graduate Scholarship Program,NONE,Swiss Government Excellence Scholarships; United Nations Fellowships; Government of Ireland International Education Scholarship; Chinese Government Scholarship; Fulbright U.S. Student Program; Stipendium Hungaricum; Commonwealth Scholarship and Fellowship Plan; Boren Awards; Australia Awards; Swedish Institute Scholarships; Erasmus Mundus Joint Master Degrees; Eiffel Excellence Scholarship Program; Japan-IMF Scholarship Program for Asia; Türkiye Scholarships; DAAD Scholarships,0.0,0.0,0.0,0,0.0,0.0,0,0.0,0.0,0,0.0,0.0,0,0.0,0.0,0,0.0,0.0
metadata_aware_hybrid_rag_k15,15,Which scholarships should Mongolian students verify before applying?,JICA Scholarships; Mastercard Foundation Scholars Program; New Zealand Scholarships; Rhodes Scholarship,Australia Awards; Chevening Scholarship; Chinese Government Scholarship; DAAD Scholarships; Eiffel Excellence Scholarship Program; Erasmus Mundus Joint Master Degrees; Global Korea Scholarship; Government of Ireland International Education Scholarship; Knight-Hennessy Scholars; Swedish Institute Scholarships; Swiss Government Excellence Scholarships; Türkiye Scholarships; United Nations Fellowships; Vanier Canada Graduate Scholarships,Commonwealth Scholarship and Fellowship Plan; Swedish Institute Scholarships; Erasmus Mundus Joint Master Degrees; Government of Ireland International Education Scholarship; Chevening Scholarship; Vanier Canada Graduate Scholarships; Chinese Government Scholarship; Swiss Government Excellence Scholarships; Australia Awards; United Nations Fellowships; Global Korea Scholarship; Knight-Hennessy Scholars; Eiffel Excellence Scholarship Program; DAAD Scholarships; Türkiye Scholarships,0.0,0.0,0.0,0,0.0,0.0,0,0.0,0.0,0,0.0,0.0,0,0.0,0.0,0,0.0,0.0
metadata_aware_hybrid_rag_k15,15,Which scholarships are for Mongolian high school students only?,,NONE,The Gates Scholarship; Chinese Government Scholarship; Benjamin A. Gilman International Scholarship; Boren Awards; Erasmus Mundus Joint Master Degrees; Swedish Institute Scholarships; Marshall Scholarship; Swiss Government Excellence Scholarships; Commonwealth Scholarship and Fellowship Plan; Government of Ireland International Education Scholarship; MEXT Scholarship; United Nations Fellowships; Eiffel Excellence Scholarship Program; NSF Graduate Research Fellowship Program; Vanier Canada Graduate Scholarships,1.0,1.0,1.0,1,1.0,1.0,1,1.0,1.0,1,1.0,1.0,1,1.0,1.0,1,1.0,1.0
metadata_aware_hybrid_rag_k15,15,Which scholarships require no degree at all?,,NONE,Swiss Government Excellence Scholarships; Churchill Scholarship; Vanier Canada Graduate Scholarships; Marshall Scholarship; Erasmus Mundus Joint Master Degrees; Australia Awards; Boren Awards; Fulbright U.S. Student Program; Commonwealth Scholarship and Fellowship Plan; New Zealand Scholarships; Swedish Institute Scholarships; Government of Ireland International Education Scholarship; DAAD Scholarships; Rhodes Scholarship; Gates Cambridge Scholarship,1.0,1.0,1.0,1,1.0,1.0,1,1.0,1.0,1,1.0,1.0,1,1.0,1.0,1,1.0,1.0
metadata_aware_hybrid_rag_k15,15,Which scholarships are fully funded in Antarctica?,,NONE,Chevening Scholarship; Google Generation Scholarship; ADB Internship Program; Swedish Institute Scholarships; Erasmus Mundus Joint Master Degrees; Swiss Government Excellence Scholarships; JICA Scholarships; United Nations Fellowships; New Zealand Scholarships; Government of Ireland International Education Scholarship; DAAD Scholarships; The Gates Scholarship; Churchill Scholarship; Australia Awards; Vanier Canada Graduate Scholarships,1.0,1.0,1.0,1,1.0,1.0,1,1.0,1.0,1,1.0,1.0,1,1.0,1.0,1,1.0,1.0
metadata_aware_hybrid_rag_k15,15,Which scholarships are only for Mongolian domestic study?,,NONE,The Gates Scholarship; Swiss Government Excellence Scholarships; NSF Graduate Research Fellowship Program; Boren Awards; Swedish Institute Scholarships; United Nations Fellowships; Erasmus Mundus Joint Master Degrees; Benjamin A. Gilman International Scholarship; Commonwealth Scholarship and Fellowship Plan; Fulbright U.S. Student Program; Government of Ireland International Education Scholarship; Australia Awards; AAUW International Fellowships; Marshall Scholarship; DAAD Scholarships,1.0,1.0,1.0,1,1.0,1.0,1,1.0,1.0,1,1.0,1.0,1,1.0,1.0,1,1.0,1.0
